id	identifier	gene_symbol	population	gender	pubmed	doi	source	text
HLA-DRB5_in_10.1111/j.1749-6632.1991.tb16970.x	HLA-DRB5	HLA-DRB5	Dutch	male/female	1859103	10.1111/j.1749-6632.1991.tb16970.x	http://doi.org/10.1111/j.1749-6632.1991.tb16970.x	HLA-DRB5 genetic variant in  major histocompatibility complex, class II, DR beta 5 (HLA-DRB5) with location 6p21.32 has non-significant association with longevity for male and femalein Dutch population in a study conducted in 1991. The study had the following design: 964 inhabitants aged 85 years and over and 2444 young controls, aged 20-35 years, with an identical ethnic and demographic background were examined. The study concluded the following. Without correcting for multiple testing, HLA-DR5 was higher in the group of 85 years and over, as compared to the control groupThe study was published with pubmed id 1859103 with DOI http://doi.org/10.1111/j.1749-6632.1991.tb16970.x
HLA-B40_in_10.1111/j.1749-6632.1991.tb16970.x	HLA-B40	HLA-B	French	male/female	1859103	10.1111/j.1749-6632.1991.tb16970.x	http://doi.org/10.1111/j.1749-6632.1991.tb16970.x	HLA-B40 genetic variant in  major histocompatibility complex, class I, B (HLA-B) with location 6p21.33 has non-significant association with longevity for male and femalein French population in a study conducted in 1991. The study had the following design: 964 inhabitants aged 85 years and over and 2444 young controls, aged 20-35 years, with an identical ethnic and demographic background were examined. The study concluded the following. Without correcting for multiple testing, HLA-B40 was lower in the group of 85 years and over, as compared to the control groupThe study was published with pubmed id 1859103 with DOI http://doi.org/10.1111/j.1749-6632.1991.tb16970.x
APOB_in_10.1161/01.atv.14.7.1084	APOB	APOB	Finnish	male/female	8018664	10.1161/01.atv.14.7.1084	http://doi.org/10.1161/01.atv.14.7.1084	APOB genetic variant in  apolipoprotein B (APOB) with location 2p24.1 has non-significant association with longevity for male and femalein Finnish population in a study conducted in 1994. The study had the following design: The apolipoprotein B Xba I polymorphism was examined in 179 Finnish centenarians. The study concluded the following. The frequencies of the Xba I alleles among the centenarians and among the young Finns were not significantly differentThe study was published with pubmed id 8018664 with DOI http://doi.org/10.1161/01.atv.14.7.1084
APOC3_in_10.1161/01.atv.14.7.1084	APOC3	APOC3	Swedish	male/female	8018664	10.1161/01.atv.14.7.1084	http://doi.org/10.1161/01.atv.14.7.1084	APOC3 genetic variant in  apolipoprotein C3 (APOC3) with location 11q23.3 has significant association with longevity for male and femalein Swedish population in a study conducted in 1994. The study had the following design: The Sst I polymorphism was examined in 179 Finnish centenarians. The study concluded the following. The S2 allele (Sst I restriction site present) occurred more often in the centenarians (frequency, 12.9%) than in the youngest reference population (frequency, 8.8%)The study was published with pubmed id 8018664 with DOI http://doi.org/10.1161/01.atv.14.7.1084
rs7412_in_10.1161/01.atv.14.7.1084	rs7412	APOE	Italian	male/female	8018664	10.1161/01.atv.14.7.1084	http://doi.org/10.1161/01.atv.14.7.1084	rs7412 genetic variant in  apolipoprotein E (APOE) with location 19q13.32 has significant association with longevity for male and femalein Italian population in a study conducted in 1994. The study had the following design: The common polymorphism of apolipoprotein E (E2, E3, and E4) was examined in 179 Finnish centenarians. The study concluded the following. The frequency of the E2 allele was higher and that of the E4 allele lower in the centenariansThe study was published with pubmed id 8018664 with DOI http://doi.org/10.1161/01.atv.14.7.1084
rs1799752_in_10.1038/ng0194-29	rs1799752	ACE	English (Cambridge)	male/female	8136829	10.1038/ng0194-29	http://doi.org/10.1038/ng0194-29	rs1799752 genetic variant in  angiotensin I converting enzyme (ACE) with location 17q23.3 has significant association with longevity for male and femalein English (Cambridge) population in a study conducted in 1994. The study had the following design: I/D polymorphism was examined in centenarians (n = 338) and in adults aged 20-70 years. The study concluded the following. A variant of ACE which predisposes to coronary heart disease was more frequent in centenarians with a significant increase of the homozygous genotypeThe study was published with pubmed id 8136829 with DOI http://doi.org/10.1038/ng0194-29
APOB_in_10.1016/0021-9150(94)90011-6	APOB	APOB	Danish	male/female	8155090	10.1016/0021-9150(94)90011-6	http://doi.org/10.1016/0021-9150(94)90011-6	APOB genetic variant in  apolipoprotein B (APOB) with location 2p24.1 has significant association with longevity for male and femalein Danish population in a study conducted in 1994. The study had the following design: The apolipoprotein B EcoRI and Xba I polymorphisms were examined in Finnish nonagenarians. The study concluded the following. The frequency of the EcoRI allele R- was somewhat lower in the nonagenarians, particularly in women. The allele frequency for the Xba I polymorphism did not differ between the nonagenarians and the younger groups.The study was published with pubmed id 8155090 with DOI http://doi.org/10.1016/0021-9150(94)90011-6
rs7412_in_10.1016/0021-9150(94)90011-6	rs7412	APOE	Spanish	male/female	8155090	10.1016/0021-9150(94)90011-6	http://doi.org/10.1016/0021-9150(94)90011-6	rs7412 genetic variant in  apolipoprotein E (APOE) with location 19q13.32 has significant association with longevity for male and femalein Spanish population in a study conducted in 1994. The study had the following design: The common polymorphism of apolipoprotein E (E2, E3, and E4) was examined in Finnish nonagenarians. The study concluded the following. The frequency of the E4 allele was lower in the nonagenarians than in the middle-aged and young adultsThe study was published with pubmed id 8155090 with DOI http://doi.org/10.1016/0021-9150(94)90011-6
rs7412_in_8403397	rs7412	APOE	English (Caucasian) and Nigerian	male/female	8403397	8403397	http://doi.org/8403397	rs7412 genetic variant in  apolipoprotein E (APOE) with location 19q13.32 has significant association with longevity for male and femalein English (Caucasian) and Nigerian population in a study conducted in 1993. The study had the following design: Isoforms were examined in 407 healthy Swedish individuals, 244 men and 163 women, ages 17 to 86 years. The study concluded the following. The E4 frequency decreased with increasing age and was significantly lower in individuals > 60 years of ageThe study was published with pubmed id 8403397 with DOI http://doi.org/8403397
APOB_in_10.1007/s004390050364	APOB	APOB	Finnish, American, Mexican and Japanese	male/female	9050915	10.1007/s004390050364	http://doi.org/10.1007/s004390050364	APOB genetic variant in  apolipoprotein B (APOB) with location 2p24.1 has significant association with longevity for male and femalein Finnish, American, Mexican and Japanese population in a study conducted in 1997. The study had the following design: A sample of 143 centenarians and a control sample of 158 individuals were examined for polymorphism in APOB restriction fragment length (RFLP) (XbaI2488 and EcoRI4154) and variable number of tandem repeat (VNTR) (3'APOB-VNTR) polymorphisms. The study concluded the following. Neither the XbaI-RFLP nor the EcoRI-RFLP was able to discriminate between centenarians and controls, while the 3'APOB-VNTR multiallelic system revealed significant differences between the samples: the frequency of alleles with fewer than 35 repeats was lower in centenarians than in controlsThe study was published with pubmed id 9050915 with DOI http://doi.org/10.1007/s004390050364
rs7412_in_10.1007/BF03324333	rs7412	APOE	Swiss	male/female	8541369	10.1007/BF03324333	http://doi.org/10.1007/BF03324333	rs7412 genetic variant in  apolipoprotein E (APOE) with location 19q13.32 has non-significant association with longevity for male and femalein Swiss population in a study conducted in 1995. The study had the following design: APOE common polymorphism (E2, E3, and E4) was examined in a sample of 228 healthy Italian subjects (124 men and 104 women) aged 18-93. The study concluded the following. The frequency of E4 decreased with age and was not found in subjects aged 75 and olderThe study was published with pubmed id 8541369 with DOI http://doi.org/10.1007/BF03324333
APOC1_in_10.1016/s0021-9150(96)06027-3	APOC1	APOC1	Italian (Northern)	male/female	9105559	10.1016/s0021-9150(96)06027-3	http://doi.org/10.1016/s0021-9150(96)06027-3	APOC1 genetic variant in  apolipoprotein C1 (APOC1) with location 19q13.32 has significant association with longevity for male and femalein Italian (Northern) population in a study conducted in 1997. The study had the following design: Allele and genotype frequencies at Hpa1 RFLP were examined in 182 women and 100 men aged >84 years and in 100 boys and 100 girls younger than 17 years. The study concluded the following. Allele and genotype frequencies were significantly different in the elderly women compared to the younger sample. No difference was observed in the elderly men.The study was published with pubmed id 9105559 with DOI http://doi.org/10.1016/s0021-9150(96)06027-3
rs1799752_in_10.1016/s0021-9150(96)06027-3	rs1799752	ACE	Russian	male/female	9105559	10.1016/s0021-9150(96)06027-3	http://doi.org/10.1016/s0021-9150(96)06027-3	rs1799752 genetic variant in  angiotensin I converting enzyme (ACE) with location 17q23.3 has significant association with longevity for male and femalein Russian population in a study conducted in 1997. The study had the following design: I/D polymorphism was examined in 182 women and 100 men aged >84 years and in 100 boys and 100 girls younger than 17 years. The study concluded the following. The I/I polymorphism was depleted in the elderly males but not in the elderly females. Furthermore, significant differences were observed between ACE genotypes in elderly men and elderly women.The study was published with pubmed id 9105559 with DOI http://doi.org/10.1016/s0021-9150(96)06027-3
rs7412_in_10.1016/s0021-9150(96)06027-3	rs7412	APOE	German 	male/female	9105559	10.1016/s0021-9150(96)06027-3	http://doi.org/10.1016/s0021-9150(96)06027-3	rs7412 genetic variant in  apolipoprotein E (APOE) with location 19q13.32 has non-significant association with longevity for male and femalein German  population in a study conducted in 1997. The study had the following design: Common polymorphism was examined in 182 women and 100 men aged > 84 years and in 100 boys and 100 girls younger than 17 years. The study concluded the following. Difference between genotypes in the elderly women and the young sample was observed. However, this did not retain significance when the genotype frequencies of the young sample were adjusted to values expected from the allele frequencies on the basis of Hardy-Weinberg equilibrium and compared to observed genotypes in elderly men and women.The study was published with pubmed id 9105559 with DOI http://doi.org/10.1016/s0021-9150(96)06027-3
rs1801133_in_10.1016/s0021-9150(96)06027-3	rs1801133	MTHFR	Chinese (Uighur, Kazakh and Han in Xinjiang)	male/female	9105559	10.1016/s0021-9150(96)06027-3	http://doi.org/10.1016/s0021-9150(96)06027-3	rs1801133 genetic variant in  methylenetetrahydrofolate reductase (MTHFR) with location 1p36.22 has non-significant association with longevity for male and femalein Chinese (Uighur, Kazakh and Han in Xinjiang) population in a study conducted in 1997. The study had the following design: The 677C/T SNP was examined in 182 women and 100 men aged > 84 years and in 100 boys and 100 girls younger than 17 years. The study concluded the following. MTHFR allele and genotype frequencies were similar in the elderly and young populationsThe study was published with pubmed id 9105559 with DOI http://doi.org/10.1016/s0021-9150(96)06027-3
R353Q_in_10.1161/01.atv.17.4.755	R353Q	F7	American (Caucasian)	male/female	9108791	10.1161/01.atv.17.4.755	http://doi.org/10.1161/01.atv.17.4.755	R353Q genetic variant in  coagulation factor VII (F7) with location 13q34 has non-significant association with longevity for male and femalein American (Caucasian) population in a study conducted in 1997. The study had the following design: The R353Q substitution polymorphism in exon 8 was examined in 124 healthy individuals over 100 years of age and 130 young, healthy individuals. The study concluded the following. No significant differences relative to longevity were foundThe study was published with pubmed id 9108791 with DOI http://doi.org/10.1161/01.atv.17.4.755
rs1800790_in_10.1161/01.atv.17.4.755	rs1800790	FGB	Chinese (Uighur in Xinjiang)	male/female	9108791	10.1161/01.atv.17.4.755	http://doi.org/10.1161/01.atv.17.4.755	rs1800790 genetic variant in  fibrinogen beta chain (FGB) with location 4q31.3 has non-significant association with longevity for male and femalein Chinese (Uighur in Xinjiang) population in a study conducted in 1997. The study had the following design: The G/A-455 SNP was examined in 124 healthy individuals over 100 years old and 130 young, healthy individuals. The study concluded the following. Alleles and genotypes were found with similar frequencies in centenarians and in the control groupThe study was published with pubmed id 9108791 with DOI http://doi.org/10.1161/01.atv.17.4.755
rs1799889_in_10.1161/01.atv.17.4.755	rs1799889	SERPINE1	Italian (Sicily)	male/female	9108791	10.1161/01.atv.17.4.755	http://doi.org/10.1161/01.atv.17.4.755	rs1799889 genetic variant in  serpin family E member 1 (SERPINE1) with location 7q22.1 has significant association with longevity for male and femalein Italian (Sicily) population in a study conducted in 1997. The study had the following design: The 1-bp guanine deletion/insertion (4G/5G) polymorphism in the promoter region was examined in 124 healthy individuals >100 years old and 130 young, healthy individuals. The study concluded the following. In centenarians there was a significantly higher frequency of the 4G allele and of the homozygous 4G4G genotype associated with high PAI-1 (SERPINE1) levelsThe study was published with pubmed id 9108791 with DOI http://doi.org/10.1161/01.atv.17.4.755
rs1799752_in_10.1161/01.cir.95.10.2358	rs1799752	ACE	American (Caucasians) and Italian	male/female	9170397	10.1161/01.cir.95.10.2358	http://doi.org/10.1161/01.cir.95.10.2358	rs1799752 genetic variant in  angiotensin I converting enzyme (ACE) with location 17q23.3 has non-significant association with longevity for male and femalein American (Caucasians) and Italian population in a study conducted in 1997. The study had the following design: ACE (I/D) polymorphism was examined in 10,150 subjects from 20 to >80 years-old. The study concluded the following. The relative frequency of the D allele did not change as a function of ageThe study was published with pubmed id 9170397 with DOI http://doi.org/10.1161/01.cir.95.10.2358
CYP2D6_in_10.1093/ageing/26.2.147	CYP2D6	CYP2D6	Polish	male/female	9177672	10.1093/ageing/26.2.147	http://doi.org/10.1093/ageing/26.2.147	CYP2D6 genetic variant in  cytochrome P450 family 2 subfamily D member 6 (CYP2D6) with location 22q13.2 has non-significant association with longevity for male and femalein Polish population in a study conducted in 1997. The study had the following design: The enzymatic polymorphism was examined in 41 nonagenarians (10 males, mean age 92.2 years, range 90-98) free of known malignancies or neurodegenerative diseases and in control groups comprised of 217 healthy volunteers (128 males, mean age 36.3 years). The study concluded the following. No association with longevity was foundThe study was published with pubmed id 9177672 with DOI http://doi.org/10.1093/ageing/26.2.147
CYP2E1_in_10.1093/ageing/26.2.147	CYP2E1	CYP2E1	Chinese	male/female	9177672	10.1093/ageing/26.2.147	http://doi.org/10.1093/ageing/26.2.147	CYP2E1 genetic variant in  cytochrome P450 family 2 subfamily E member 1 (CYP2E1) with location 10q26.3 has non-significant association with longevity for male and femalein Chinese population in a study conducted in 1997. The study had the following design: The enzymatic polymorphism was examined in 41 nonagenarians (10 males, mean age 92.2 years, range 90-98) free of known malignancies or neurodegenerative diseases and in control groups comprised of 137 (116 males, mean age 32 years). The study concluded the following. No association with longevity was foundThe study was published with pubmed id 9177672 with DOI http://doi.org/10.1093/ageing/26.2.147
NAT2_in_10.1093/ageing/26.2.147	NAT2	NAT2	Italian (Southern)	male/female	9177672	10.1093/ageing/26.2.147	http://doi.org/10.1093/ageing/26.2.147	NAT2 genetic variant in  N-acetyltransferase 2 (NAT2) with location 8p22 has non-significant association with longevity for male and femalein Italian (Southern) population in a study conducted in 1997. The study had the following design: The enzymatic polymorphism was examined in 41 nonagenarians (10 males, mean age 92.2 years, range 90-98) free of known malignancies or neurodegenerative diseases and in control groups comprised of 217 healthy volunteers (128 males, mean age 36.3 years). The study concluded the following. No association with longevity was foundThe study was published with pubmed id 9177672 with DOI http://doi.org/10.1093/ageing/26.2.147
HLA-DRB1_in_10.1093/hmg/7.2.187	HLA-DRB1	HLA-DRB1	Brazilian	male/female	9425225	10.1093/hmg/7.2.187	http://doi.org/10.1093/hmg/7.2.187	HLA-DRB1 genetic variant in  major histocompatibility complex, class II, DR beta 1 (HLA-DRB1) with location 6p21.32 has significant association with longevity for male and femalein Brazilian population in a study conducted in 1998. The study had the following design: The longevous groups included two independent cohorts totalling 533 centenarians and 163 nonagenarian siblings. Control group included 2950 subjects.. The study concluded the following. DR7 frequency was elevated in longevous men and DR13 frequency was increased in centenarians. DR11's influence on longevity displayed a significant interaction with sex, with an increase in women from longevous sibships. HLA-DR homozygotes were more frequent in centenarians than in controls.The study was published with pubmed id 9425225 with DOI http://doi.org/10.1093/hmg/7.2.187
APOA4_in_10.1016/s0304-3940(98)00025-1	APOA4	APOA4	Japanese	male/female	9533408	10.1016/s0304-3940(98)00025-1	http://doi.org/10.1016/s0304-3940(98)00025-1	APOA4 genetic variant in  apolipoprotein A4 (APOA4) with location 11q23.3 has non-significant association with longevity for male and femalein Japanese population in a study conducted in 1998. The study had the following design: Glutamine (CAG) to histidine (CAT) substitution at codon 360 was examined in 120 Alzheimer patients (88 females, 32 males) and 119 presumed-healthy elderly subjects (62 females, 57 males). The study concluded the following. The frequency of apoAIV alleles was not significantly different between Alzheimer patients and the elderly control group. However, in both groups, apoAIV (360:His) allele frequency was higher than in the general population.The study was published with pubmed id 9533408 with DOI http://doi.org/10.1016/s0304-3940(98)00025-1
GSTM1_in_10.1007/s004390050735	GSTM1	GSTM1	Korean	male/female	9654200	10.1007/s004390050735	http://doi.org/10.1007/s004390050735	GSTM1 genetic variant in  glutathione S-transferase mu 1 (GSTM1) with location 1p13.3 has non-significant association with longevity for male and femalein Korean population in a study conducted in 1998. The study had the following design: The GSTM1 deletion was examined in 552 centenarians and 243 controls aged 20-70 years. The study concluded the following. No significant difference was found between centenarian and control subjectsThe study was published with pubmed id 9654200 with DOI http://doi.org/10.1007/s004390050735
638G/A_in_9854023	638G/A	SULT1A1	Italian (Northern and Central)	male/female	9854023	9854023	http://doi.org/9854023	638G/A genetic variant in  sulfotransferase family 1A member 1 (SULT1A1) with location 16p11.2 has significant association with longevity for male and femalein Italian (Northern and Central) population in a study conducted in 1999. The study had the following design: 638G/A (Arg 213 to His) SNP was examined in Caucasian (n=293; 12-99 years old) and African (Nigerian, n=52) populations. The study concluded the following. A significant age-related difference in genotype was observed within Caucasian population, with increasing incidence of SULT1A11 homozygosity and decreasing incidence of SULT1A12 homozygosity with increasing ageThe study was published with pubmed id 9854023 with DOI http://doi.org/9854023
PARP1_in_10.1038/sj.ejhg.5200222	PARP1	PARP1	Italian (Nothern and Central)	male/female	9887369	10.1038/sj.ejhg.5200222	http://doi.org/10.1038/sj.ejhg.5200222	PARP1 genetic variant in  poly(ADP-ribose) polymerase 1 (PARP1) with location 1q42.12 has non-significant association with longevity for male and femalein Italian (Nothern and Central) population in a study conducted in 1998. The study had the following design: Polymorphic repeats in exon 1 were examined in 196 centenarians (143 females and 53 males) and 358 controls (196 females and 162 male; 10-85 years old). The study concluded the following. No significant difference in genotypic frequencies was found between centenarians and controlsThe study was published with pubmed id 9887369 with DOI http://doi.org/10.1038/sj.ejhg.5200222
REN_in_10.1038/sj.ejhg.5200222	REN	REN	Irish	male/female	9887369	10.1038/sj.ejhg.5200222	http://doi.org/10.1038/sj.ejhg.5200222	REN genetic variant in  renin (REN) with location 1q32.1 has non-significant association with longevity for male and femalein Irish population in a study conducted in 1998. The study had the following design: Polymorphic repeats in intron 7 (Short and Long alleles) were examined in 196 centenarians (143 females and 53 males) and 358 controls (196 females and 162 male; 10-85 years old). The study concluded the following. No significant difference in genotypic frequencies was found between centenarians and controlsThe study was published with pubmed id 9887369 with DOI http://doi.org/10.1038/sj.ejhg.5200222
TH_in_10.1038/sj.ejhg.5200222	TH	TH	Irish (Belfast)	male/female	9887369	10.1038/sj.ejhg.5200222	http://doi.org/10.1038/sj.ejhg.5200222	TH genetic variant in  tyrosine hydroxylase (TH) with location 11p15.5 has significant association with longevity for male and femalein Irish (Belfast) population in a study conducted in 1998. The study had the following design: Polymorphic repeats in intron 1 (Short and Long alleles) were examined in 196 centenarians (143 females and 53 males) and 358 controls (196 females and 162 male; 10-85 years old). The study concluded the following. A significant loss of LL homozygous genotypes was found at the THO locus in male but not in female centenarians with respect to matched controlsThe study was published with pubmed id 9887369 with DOI http://doi.org/10.1038/sj.ejhg.5200222
401C/T_in_10.1038/sj.ejhg.5200222	401C/T	SOD2	Italian, French and Danish	male/female	9887369	10.1038/sj.ejhg.5200222	http://doi.org/10.1038/sj.ejhg.5200222	401C/T genetic variant in  superoxide dismutase 2 (SOD2) with location 6q25.3 has non-significant association with longevity for male and femalein Italian, French and Danish population in a study conducted in 1998. The study had the following design: 401C/T SNP was examined in 196 centenarians (143 females and 53 males) and 358 controls (196 females and 162 male; 10-85 years old). The study concluded the following. No significant difference in genotypic frequencies was found between centenarians and controlsThe study was published with pubmed id 9887369 with DOI http://doi.org/10.1038/sj.ejhg.5200222
rs1799752_in_9761238	rs1799752	ACE	Irish (Northern)	male/female	9761238	9761238	http://doi.org/9761238	rs1799752 genetic variant in  angiotensin I converting enzyme (ACE) with location 17q23.3 has significant association with longevity for male and femalein Irish (Northern) population in a study conducted in 1998. The study had the following design: I/D polymorphism was examined in 394 French centenarians (13% men and 87% women) and controls (238) from 20 to 70 years of age (140 men and 98 women). The study concluded the following. Both the ACE D allele and ACE D/D genotype were more frequent in centenarians in comparison with controls, without sex-related differences nor a significant correlation with cardiovascular pathologyThe study was published with pubmed id 9761238 with DOI http://doi.org/9761238
C1367R_in_10069711	C1367R	WRN	American	male/female	10069711	10069711	http://doi.org/10069711	C1367R genetic variant in  Werner syndrome RecQ like helicase (WRN) with location 8p12 has non-significant association with longevity for male and femalein American population in a study conducted in 1999. The study had the following design: The 1367 Cys/Arg polymorphism was examined during aging in 175 Finnish centenarians and 178 newborns, 169 Mexican newborns, 23 North American adults and 198 Japanese adults. The study concluded the following. When newborns and centenarians were compared within the Finnish population no differences were observed in the proportions of 1367 Cys/Arg across age groups. The frequency of the 1367 Arg allele, thought to be protective against myocardial infarction in a Japanese population, was approximately three times higher in the North American and Finnish adult populations.The study was published with pubmed id 10069711 with DOI http://doi.org/10069711
