id	identifier	gene_symbol	population	gender	pubmed	doi	source	text
rs1800790_in_10.1016/s0531-5565(01)00102-4	rs1800790	FGB	European (Danish, Finnish, South Italian and Greek)	male/female	11602206	10.1016/s0531-5565(01)00102-4	http://doi.org/10.1016/s0531-5565(01)00102-4	rs1800790 genetic variant in  fibrinogen beta chain (FGB) with location 4q31.3 has non-significant association with longevity for male and femalein European (Danish, Finnish, South Italian and Greek) population in a study conducted in 2001. The study had the following design: The G/A-455 SNP was examined in 187 centenarians (47 males and 140 females) and 201 controls (20-64 years). The study concluded the following. No association with longevity was foundThe study was published with pubmed id 11602206 with DOI http://doi.org/10.1016/s0531-5565(01)00102-4
rs7412_in_10.1016/s0047-6374(01)00338-4	rs7412	APOE	Caucasian	male/female	11640949	10.1016/s0047-6374(01)00338-4	http://doi.org/10.1016/s0047-6374(01)00338-4	rs7412 genetic variant in  apolipoprotein E (APOE) with location 19q13.32 has significant association with longevity for male and femalein Caucasian population in a study conducted in 2001. The study had the following design: Common polymorphism (E2, E3, and E4) was studied in 164 subjects including 35 persons aged 90 years or older, 71 men aged 20-35 and 54 men with myocardial infarction. The study concluded the following. There was a statistically significant difference in the E4 allele frequencies among the three groups with the older group showing a lower E4 allele frequencyThe study was published with pubmed id 11640949 with DOI http://doi.org/10.1016/s0047-6374(01)00338-4
IL10_in_10.1016/s0047-6374(01)00338-4	IL10	IL10	Japanese (Okinawa)	male/female	11640949	10.1016/s0047-6374(01)00338-4	http://doi.org/10.1016/s0047-6374(01)00338-4	IL10 genetic variant in  interleukin 10 (IL10) with location 1q32.1 has non-significant association with longevity for male and femalein Japanese (Okinawa) population in a study conducted in 2001. The study had the following design: 250 (52 males and 198 females) nonagenarians and 400 healthy control group (18-60 years old) were examined for 1082 SNP. The study concluded the following. No significant differences relative to longevity were foundThe study was published with pubmed id 11640949 with DOI http://doi.org/10.1016/s0047-6374(01)00338-4
IL1B_in_10.1016/s0047-6374(01)00338-4	IL1B	IL1B	Finnish and Mexican	male/female	11640949	10.1016/s0047-6374(01)00338-4	http://doi.org/10.1016/s0047-6374(01)00338-4	IL1B genetic variant in  interleukin 1 beta (IL1B) with location 2q14.1 has non-significant association with longevity for male and femalein Finnish and Mexican population in a study conducted in 2001. The study had the following design: 250 (52 males and 198 females) nonagenarians and 400 healthy control group blood donors (18-60 years old) were examined for +3953 and -511 SNPs. The study concluded the following. No significant differences relative to longevity were foundThe study was published with pubmed id 11640949 with DOI http://doi.org/10.1016/s0047-6374(01)00338-4
-889C/T_in_10.1016/s0047-6374(01)00338-4	-889C/T	IL1A	Czechs (Bohemian), Americans (Baltimore Caucasians and African-Americans)	male/female	11640949	10.1016/s0047-6374(01)00338-4	http://doi.org/10.1016/s0047-6374(01)00338-4	-889C/T genetic variant in  interleukin 1 alpha (IL1A) with location 2q14.1 has non-significant association with longevity for male and femalein Czechs (Bohemian), Americans (Baltimore Caucasians and African-Americans) population in a study conducted in 2001. The study had the following design: 250 (52 males and 198 females) nonagenarians and 400 healthy control group (18-60 years old) were examined for -889 SNP. The study concluded the following. No significant differences relative to longevity were foundThe study was published with pubmed id 11640949 with DOI http://doi.org/10.1016/s0047-6374(01)00338-4
IL1RN_in_10.1016/s0047-6374(01)00338-4	IL1RN	IL1RN	Italian, Ashkenazi Jewish and Japanese	male/female	11640949	10.1016/s0047-6374(01)00338-4	http://doi.org/10.1016/s0047-6374(01)00338-4	IL1RN genetic variant in  interleukin 1 receptor antagonist (IL1RN) with location 2q14.1 has non-significant association with longevity for male and femalein Italian, Ashkenazi Jewish and Japanese population in a study conducted in 2001. The study had the following design: 250 (52 males and 198 females) nonagenarians and 400 healthy control (18-60 years old) were examined for VNTR polymorphism in intron 2 (an 86 bp repeat sequence). The study concluded the following. No significant differences relative to longevity were foundThe study was published with pubmed id 11640949 with DOI http://doi.org/10.1016/s0047-6374(01)00338-4
IL6_in_10.1016/s0047-6374(01)00338-4	IL6	IL6	American of Japanese origin	male/female	11640949	10.1016/s0047-6374(01)00338-4	http://doi.org/10.1016/s0047-6374(01)00338-4	IL6 genetic variant in  interleukin 6 (IL6) with location 7p15.3 has non-significant association with longevity for male and femalein American of Japanese origin population in a study conducted in 2001. The study had the following design: 250 (52 males and 198 females) nonagenarians and 400 healthy control group (18-60 years old) were examined for -174, +3953 and -511 SNPs. The study concluded the following. No significant differences relative to longevity were foundThe study was published with pubmed id 11640949 with DOI http://doi.org/10.1016/s0047-6374(01)00338-4
rs1800629_in_10.1016/s0047-6374(01)00338-4	rs1800629	TNF	European and American (Caucasian)	male/female	11640949	10.1016/s0047-6374(01)00338-4	http://doi.org/10.1016/s0047-6374(01)00338-4	rs1800629 genetic variant in  tumor necrosis factor (TNF) with location 6p21.33 has non-significant association with longevity for male and femalein European and American (Caucasian) population in a study conducted in 2001. The study had the following design: 250 (52 males and 198 females) nonagenarians and 400 healthy control group (18-60 years old) were examined for -308 SNP. The study concluded the following. No significant differences relative to longevity were foundThe study was published with pubmed id 11640949 with DOI http://doi.org/10.1016/s0047-6374(01)00338-4
IGF2_in_10.1016/s0531-5565(01)00146-2	IGF2	IGF2	American (Caucasians), Italian (Southern), French, Ashkenazi Jewish 	male/female	11672987	10.1016/s0531-5565(01)00146-2	http://doi.org/10.1016/s0531-5565(01)00146-2	IGF2 genetic variant in  insulin like growth factor 2 (IGF2) with location 11p15.5 has non-significant association with longevity for male and femalein American (Caucasians), Italian (Southern), French, Ashkenazi Jewish  population in a study conducted in 2001. The study had the following design: Exon 9 AvaII RFLP polymorphism was examined in 219 centenarians (72 males and 147 females) and 256 (controls 20-70 years, 119 males and 137 females). The study concluded the following. No significant difference between centenarians and controls was observedThe study was published with pubmed id 11672987 with DOI http://doi.org/10.1016/s0531-5565(01)00146-2
FokI RFLP_in_10.1016/s0531-5565(01)00146-2	FokI RFLP	INS	Germany, Italian, Chinese (Han)	male/female	11672987	10.1016/s0531-5565(01)00146-2	http://doi.org/10.1016/s0531-5565(01)00146-2	FokI RFLP genetic variant in  insulin (INS) with location 11p15.5 has non-significant association with longevity for male and femalein Germany, Italian, Chinese (Han) population in a study conducted in 2001. The study had the following design: FokI RFLP polymorphism was examined in 219 centenarians (72 males and 147 females) and 256 (controls 20-70 years, 119 males and 137 females). The study concluded the following. No significant difference between centenarians and controls was observedThe study was published with pubmed id 11672987 with DOI http://doi.org/10.1016/s0531-5565(01)00146-2
BRCA1_in_10.1111/j.1749-6632.2001.tb05639.x	BRCA1	BRCA1	Italian (Northern) and Japanese	male/female	11795532	10.1111/j.1749-6632.2001.tb05639.x	http://doi.org/10.1111/j.1749-6632.2001.tb05639.x	BRCA1 genetic variant in  BRCA1, DNA repair associated (BRCA1) with location 17q21.31 has non-significant association with longevity for male and femalein Italian (Northern) and Japanese population in a study conducted in 2001. The study had the following design: Polymorphisms were examined in 102 centenarians from the New England area and 84 centenarians from Italy. The control population consisted of 97 individuals from Italy.. The study concluded the following. The genotype a+a was more frequent in both centenarian groups compared to the control group whereas the genotype a+b was less frequent. The results however were not statistically significant.The study was published with pubmed id 11795532 with DOI http://doi.org/10.1111/j.1749-6632.2001.tb05639.x
rs1799752_in_10.1093/gerona/57.1.m57	rs1799752	ACE	American (Caucasian), Ashkenazi Jewish	male/female	11773214	10.1093/gerona/57.1.m57	http://doi.org/10.1093/gerona/57.1.m57	rs1799752 genetic variant in  angiotensin I converting enzyme (ACE) with location 17q23.3 has significant association with longevity for male and femalein American (Caucasian), Ashkenazi Jewish population in a study conducted in 2002. The study had the following design: I/D polymorphism was examined in 424 subjects comprising 227 Uighur individuals, 108 Kazakh individuals, and 89 Han individuals. All subjects in the latter two groups ranged in age from 65 to 70 years, whereas the Uighur subjects comprised two different age groups: those ranging in age from 59 to 70 years and those ranging in age from 90 to 113 years.. The study concluded the following. Within the Uighur group, frequency of the D allele was significantly higher in the group aged >90 than in the group aged <70. The overall distributions of alleles in the three groups did not differ significantly.The study was published with pubmed id 11773214 with DOI http://doi.org/10.1093/gerona/57.1.m57
rs2430561_in_10.1038/sj.gene.6363827	rs2430561	IFNG	American (Caucasian and AfricanAmerican), Ashkenazi Jewish	male/female	11857058	10.1038/sj.gene.6363827	http://doi.org/10.1038/sj.gene.6363827	rs2430561 genetic variant in  interferon gamma (IFNG) with location 12q15 has significant association with longevity for male and femalein American (Caucasian and AfricanAmerican), Ashkenazi Jewish population in a study conducted in 2002. The study had the following design: The distribution of the 874T/A polymorphism was examined in 174 Italian centenarians (>99 years old, 142 women and 32 men) and 248 <60-year-old control subjects (90 women and 158 men). The study concluded the following. The +874T allele, known to be associated with low IFN-gamma production, was found less frequently in centenarian women than in centenarian men or in control women whereas no significant differences were observed in the distribution of the two alleles between male or female controls. Allele frequencies in centenarian men were not found significantly different from male controls.The study was published with pubmed id 11857058 with DOI http://doi.org/10.1038/sj.gene.6363827
rs1800896_in_10.1038/sj.gene.6363827	rs1800896	IL10	English (Oxford)	male/female	11857058	10.1038/sj.gene.6363827	http://doi.org/10.1038/sj.gene.6363827	rs1800896 genetic variant in  interleukin 10 (IL10) with location 1q32.1 has significant association with longevity for male and femalein English (Oxford) population in a study conducted in 2002. The study had the following design: The -1082G/A, -819C/T and -592C/A proximal promoter SNPs were examined in 190 centenarians (>99 years old, 159 women and 31 men) and in 260 control subjects (99 women and 161 men less than 60 years old). The study concluded the following. The -1082G homozygous genotype, associated with high IL-10 production, was increased in centenarian men but not in centenarian women. No difference was found between centenarians and control subjects regarding the other two SNPs.The study was published with pubmed id 11857058 with DOI http://doi.org/10.1038/sj.gene.6363827
C282Y_in_10.1038/sj.gene.6363827	C282Y	HFE	American (Caucasian), French	male/female	11857058	10.1038/sj.gene.6363827	http://doi.org/10.1038/sj.gene.6363827	C282Y genetic variant in  hemochromatosis (HFE) with location 6p22.2 has significant association with longevity for male and femalein American (Caucasian), French population in a study conducted in 2002. The study had the following design: C282Y, H63D and S65C polymorphisms were studied in 106 young controls (age range from 22 to 55 years; 40 men and 66 women) and 35 elderly subjects (age range from 91 to 105 years; seven men and 28 women). The study concluded the following. A significant difference was observed only in women in frequencies of C282Y alleles between the young and the elderly subjects. Concerning H63D polymorphisms, no significant differences were observed, between old and young people.The study was published with pubmed id 11857058 with DOI http://doi.org/10.1038/sj.gene.6363827
FAS_in_10.1038/sj.cdd.4400964	FAS	FAS	American (Caucasian and African-American)	male/female	11965496	10.1038/sj.cdd.4400964	http://doi.org/10.1038/sj.cdd.4400964	FAS genetic variant in  Fas cell surface death receptor (FAS) with location 10q23.31 has non-significant association with longevity for male and femalein American (Caucasian and African-American) population in a study conducted in 2002. The study had the following design: The -670 and -1377 position SNPs were examined in 50 centenarians and 86 young controls. The study concluded the following. Genotype and allele distribution for both polymorphisms were similar in controls and centenariansThe study was published with pubmed id 11965496 with DOI http://doi.org/10.1038/sj.cdd.4400964
