id	identifier	gene_symbol	population	gender	pubmed	doi	source	text
C3_in_10.1093/gerona/54.4.b150	C3	C3	Brazilian of European and Japanese origin	male/female	10219002	10.1093/gerona/54.4.b150	http://doi.org/10.1093/gerona/54.4.b150	C3 genetic variant in  complement C3 (C3) with location 19p13.3 has non-significant association with longevity for male and femalein Brazilian of European and Japanese origin population in a study conducted in 1999. The study had the following design: C3 alleles were examined in healthy aged people (77 centenarians and 89 elderly subjects). The study concluded the following. The frequencies of C3 alleles were similar in the studied cohortsThe study was published with pubmed id 10219002 with DOI http://doi.org/10.1093/gerona/54.4.b150
CFB_in_10.1093/gerona/54.4.b150	CFB	CFB	Ashkenazi Jewish 	male/female	10219002	10.1093/gerona/54.4.b150	http://doi.org/10.1093/gerona/54.4.b150	CFB genetic variant in  complement factor B (CFB) with location 6p21.33 has non-significant association with longevity for male and femalein Ashkenazi Jewish  population in a study conducted in 1999. The study had the following design: Alleles were examined in healthy aged people (77 centenarians and 89 elderly subjects). The study concluded the following. The frequencies of the alleles were similar in the studied cohortsThe study was published with pubmed id 10219002 with DOI http://doi.org/10.1093/gerona/54.4.b150
C4A_in_10.1093/gerona/54.4.b150	C4A	C4A	Russian (Novosibirsk)	male/female	10219002	10.1093/gerona/54.4.b150	http://doi.org/10.1093/gerona/54.4.b150	C4A genetic variant in  complement C4A (Rodgers blood group) (C4A) with location 6p21.33 has non-significant association with longevity for male and femalein Russian (Novosibirsk) population in a study conducted in 1999. The study had the following design: C4 alleles were examined in healthy aged people (77 centenarians and 89 elderly subjects). The study concluded the following. The frequencies of C4A alleles were similar in the studied cohorts. For C4B null allele (C4BQ0) a trend toward an increase in the older cohort was observed, although the differences were not statistically significant after correction for multiple testing.The study was published with pubmed id 10219002 with DOI http://doi.org/10.1093/gerona/54.4.b150
M/T235_in_10494771	M/T235	AGT	Russian (Novosibirsk)	male/female	10494771	10494771	http://doi.org/10494771	M/T235 genetic variant in  angiotensinogen (AGT) with location 1q42.2 has non-significant association with longevity for male and femalein Russian (Novosibirsk) population in a study conducted in 1999. The study had the following design: M/T235 SNP was examined in 187 centenarians and 201 controls (20-64 years). The study concluded the following. No significant differences relative to longevity were foundThe study was published with pubmed id 10494771 with DOI http://doi.org/10494771
rs1799752_in_10494771	rs1799752	ACE	Italian and N. Irish	male/female	10494771	10494771	http://doi.org/10494771	rs1799752 genetic variant in  angiotensin I converting enzyme (ACE) with location 17q23.3 has non-significant association with longevity for male and femalein Italian and N. Irish population in a study conducted in 1999. The study had the following design: I/D polymorphism was examined in 187 centenarians and 201 controls (20-64 years). The study concluded the following. No significant differences relative to longevity were foundThe study was published with pubmed id 10494771 with DOI http://doi.org/10494771
rs1799963_in_10494771	rs1799963	F2	Bulgarian	male/female	10494771	10494771	http://doi.org/10494771	rs1799963 genetic variant in  coagulation factor II, thrombin (F2) with location 11p11.2 has non-significant association with longevity for male and femalein Bulgarian population in a study conducted in 1999. The study had the following design: F2 20210 G/A SNP was examined in 187 centenarians and 201 controls (20-64 years). The study concluded the following. No association with longevity was foundThe study was published with pubmed id 10494771 with DOI http://doi.org/10494771
R353Q_in_10494771	R353Q	F7	Italian (Sardinia)	male/female	10494771	10494771	http://doi.org/10494771	R353Q genetic variant in  coagulation factor VII (F7) with location 13q34 has non-significant association with longevity for male and femalein Italian (Sardinia) population in a study conducted in 1999. The study had the following design: The R353Q substitution, intron 7 (37bp)n, and -323ins10 polymorphisms were examined in 187 centenarians and 201 healthy controls, aged 20-64 years (mean age 42 years).. The study concluded the following. The genotype frequencies in the centenarians and in the controls were similarThe study was published with pubmed id 10494771 with DOI http://doi.org/10494771
rs1800790_in_10494771	rs1800790	FGB	Ashkenazi Jewish (Jerusalem)	male/female	10494771	10494771	http://doi.org/10494771	rs1800790 genetic variant in  fibrinogen beta chain (FGB) with location 4q31.3 has non-significant association with longevity for male and femalein Ashkenazi Jewish (Jerusalem) population in a study conducted in 1999. The study had the following design: The -455G/A SNP was examined in 187 centenarians and 201 healthy controls aged 20-64 years (mean age 42 years). The study concluded the following. The genotype frequencies in the centenarians and the controls were similarThe study was published with pubmed id 10494771 with DOI http://doi.org/10494771
33L/P_in_10494771	33L/P	ITGB3	Mexican	male/female	10494771	10494771	http://doi.org/10494771	33L/P genetic variant in  integrin subunit beta 3 (ITGB3) with location 17q21.32 has non-significant association with longevity for male and femalein Mexican population in a study conducted in 1999. The study had the following design: L/P33 SNP was examined in 187 Danish centenarians and 201 healthy controls aged 20-64 years (mean age 42 years). The study concluded the following. No significant association with longevity was foundThe study was published with pubmed id 10494771 with DOI http://doi.org/10494771
PLAT_in_10494771	PLAT	PLAT	Italian (Central and Southern)	male/female	10494771	10494771	http://doi.org/10494771	PLAT genetic variant in  plasminogen activator, tissue type (PLAT) with location 8p11.21 has non-significant association with longevity for male and femalein Italian (Central and Southern) population in a study conducted in 1999. The study had the following design: Intron 8 insertion 311 polymorphism was examined in 187 Danish centenarians, and 201 healthy Danish blood donors, aged 20-64 years (mean age 42 years). The study concluded the following. No significant differences relative to longevity were foundThe study was published with pubmed id 10494771 with DOI http://doi.org/10494771
114A/V_in_10494771	114A/V	MTHFR	English	male/female	10494771	10494771	http://doi.org/10494771	114A/V genetic variant in  methylenetetrahydrofolate reductase (MTHFR) with location 1p36.22 has non-significant association with longevity for male and femalein English population in a study conducted in 1999. The study had the following design: A/V114 SNP was examined in 187 unselected centenarians, and 201 healthy controls aged 20-64 years (mean age 42 years). The study concluded the following. No significant association with longevity was foundThe study was published with pubmed id 10494771 with DOI http://doi.org/10494771
rs1799889_in_10494771	rs1799889	SERPINE1	Columbian	male/female	10494771	10494771	http://doi.org/10494771	rs1799889 genetic variant in  serpin family E member 1 (SERPINE1) with location 7q22.1 has non-significant association with longevity for male and femalein Columbian population in a study conducted in 1999. The study had the following design: The 1-bp guanine deletion/insertion (4G/5G) polymorphism was examined in 187 centenarians and 201 healthy controls aged 20-64 years (mean age 42 years). The study concluded the following. No significant differences relative to longevity were foundThe study was published with pubmed id 10494771 with DOI http://doi.org/10494771
rs1799752_in_10.1016/s0735-1097(99)00337-x	rs1799752	ACE	Greek	male/female	10520809	10.1016/s0735-1097(99)00337-x	http://doi.org/10.1016/s0735-1097(99)00337-x	rs1799752 genetic variant in  angiotensin I converting enzyme (ACE) with location 17q23.3 has non-significant association with longevity for male and femalein Greek population in a study conducted in 1999. The study had the following design: I/D polymorphism was determined in 648 subjects >85 years-old. Genotype distributions in a subset of 356 elderly subjects were compared to 250 young subjects. Mortality of elderly subjects was also followed for 10 years.. The study concluded the following. The ACE genotype distributions were similar in elderly and young subjects. No associations with mortality were found.The study was published with pubmed id 10520809 with DOI http://doi.org/10.1016/s0735-1097(99)00337-x
rs1799889_in_10.1016/s0735-1097(99)00337-x	rs1799889	SERPINE1	Mediterranean (Italian, Greek and Tunisian)	male/female	10520809	10.1016/s0735-1097(99)00337-x	http://doi.org/10.1016/s0735-1097(99)00337-x	rs1799889 genetic variant in  serpin family E member 1 (SERPINE1) with location 7q22.1 has non-significant association with longevity for male and femalein Mediterranean (Italian, Greek and Tunisian) population in a study conducted in 1999. The study had the following design: The 1-bp guanine deletion/insertion (4G/5G) polymorphism in the promoter region was examined in 648 subjects >85 years old. The study concluded the following. In the cross-sectional analysis, the genotype distributions were similar in elderly and young subjectsThe study was published with pubmed id 10520809 with DOI http://doi.org/10.1016/s0735-1097(99)00337-x
rs1801133_in_10.1046/j.1365-2362.1999.00578.x	rs1801133	MTHFR	Chinese (Han)	male/female	10583447	10.1046/j.1365-2362.1999.00578.x	http://doi.org/10.1046/j.1365-2362.1999.00578.x	rs1801133 genetic variant in  methylenetetrahydrofolate reductase (MTHFR) with location 1p36.22 has non-significant association with longevity for male and femalein Chinese (Han) population in a study conducted in 1999. The study had the following design: C677T SNP was examined in healthy subjects (n=118; age<65), older healthy subjects (n=106; age>65), patients with coronary artery disease (n=75), and patients with peripheral arterial occlusive disease (n=63). The study concluded the following. No difference in either genotype distribution or allele frequencies between patients and controls was foundThe study was published with pubmed id 10583447 with DOI http://doi.org/10.1046/j.1365-2362.1999.00578.x
CYP1A1_in_10.1006/bbrc.2001.4280	CYP1A1	CYP1A1	Jordanian	male/female	11162685	10.1006/bbrc.2001.4280	http://doi.org/10.1006/bbrc.2001.4280	CYP1A1 genetic variant in  cytochrome P450 family 1 subfamily A member 1 (CYP1A1) with location 15q24.1 has non-significant association with longevity for male and femalein Jordanian population in a study conducted in 2001. The study had the following design: Polymorphisms were examined in 94 nonagenarians and centenarians and 418 control subjects of younger age. The study concluded the following. No association with longevity was foundThe study was published with pubmed id 11162685 with DOI http://doi.org/10.1006/bbrc.2001.4280
GSTM1_in_10.1006/bbrc.2001.4280	GSTM1	GSTM1	Caucasians	male/female	11162685	10.1006/bbrc.2001.4280	http://doi.org/10.1006/bbrc.2001.4280	GSTM1 genetic variant in  glutathione S-transferase mu 1 (GSTM1) with location 1p13.3 has non-significant association with longevity for male and femalein Caucasians population in a study conducted in 2001. The study had the following design: GSTM1 deletion was examined in 94 nonagenarians and centenarians and in 418 control subjects of younger age. The study concluded the following. No association with longevity was foundThe study was published with pubmed id 11162685 with DOI http://doi.org/10.1006/bbrc.2001.4280
GSTT1_in_10.1006/bbrc.2001.4280	GSTT1	GSTT1	Italian (Palermo)	male/female	11162685	10.1006/bbrc.2001.4280	http://doi.org/10.1006/bbrc.2001.4280	GSTT1 genetic variant in  glutathione S-transferase theta 1 (GSTT1) with location 22q11.23 has significant association with longevity for male and femalein Italian (Palermo) population in a study conducted in 2001. The study had the following design: Deletion was examined in 94 nonagenarians and centenarians and 418 control subjects of younger age. The study concluded the following. A significant difference in the proportion of nonagenarians and centenarians homozygotes for the deletion was observed in comparison to control subjectsThe study was published with pubmed id 11162685 with DOI http://doi.org/10.1006/bbrc.2001.4280
rs7412_in_10.1093/gerona/56.2.m75	rs7412	APOE	American (Georgia and Louisiana populations from African and European origin)	male/female	11213279	10.1093/gerona/56.2.m75	http://doi.org/10.1093/gerona/56.2.m75	rs7412 genetic variant in  apolipoprotein E (APOE) with location 19q13.32 has significant association with longevity for male and femalein American (Georgia and Louisiana populations from African and European origin) population in a study conducted in 2001. The study had the following design: Common polymorphism was examined in 179 persons (28 men and 151 women) aged 100 years and older. The study concluded the following. The percentages of E2-allele carriers increased with age, particularly in women. The percentage of carriers of the E4 allele was lower than expected.The study was published with pubmed id 11213279 with DOI http://doi.org/10.1093/gerona/56.2.m75
T-455C_in_10.1093/gerona/56.1.b27	T-455C	APOC3	Italian (Salerno)	male/female	11193221	10.1093/gerona/56.1.b27	http://doi.org/10.1093/gerona/56.1.b27	T-455C genetic variant in  apolipoprotein C3 (APOC3) with location 11q23.3 has significant association with longevity for male and femalein Italian (Salerno) population in a study conducted in 2001. The study had the following design: 5'-untranslated region (T-455C) SNP was examined in a group of 137 elderly individuals (70-106 years old). The study concluded the following. A greater frequency of the -455C allele was demonstrated with agingThe study was published with pubmed id 11193221 with DOI http://doi.org/10.1093/gerona/56.1.b27
rs1799752_in_10.1016/s0764-4469(00)01274-9	rs1799752	ACE	European	male/female	11280044	10.1016/s0764-4469(00)01274-9	http://doi.org/10.1016/s0764-4469(00)01274-9	rs1799752 genetic variant in  angiotensin I converting enzyme (ACE) with location 17q23.3 has non-significant association with longevity for male and femalein European population in a study conducted in 2001. The study had the following design: I/D polymorphism was examined in 560 centenarians and 560 adult controls. The study concluded the following. No association was observed between ACE allele frequencies or genotype and longevityThe study was published with pubmed id 11280044 with DOI http://doi.org/10.1016/s0764-4469(00)01274-9
rs7412_in_10.1016/s0764-4469(00)01274-9	rs7412	APOE	Danish, German	male/female	11280044	10.1016/s0764-4469(00)01274-9	http://doi.org/10.1016/s0764-4469(00)01274-9	rs7412 genetic variant in  apolipoprotein E (APOE) with location 19q13.32 has significant association with longevity for male and femalein Danish, German population in a study conducted in 2001. The study had the following design: Common polymorphism (E2, E3, and E4) was examined in 560 centenarians and 560 adult controls. The study concluded the following. Significant differences were observed between centenarians and controls for allelic and genotypic frequencies. The E4E4 genotype was under-represented in centenarians compared to controls. Centenarians carrying at least one E2 allele or homozygous for E3 were more frequent than controls.The study was published with pubmed id 11280044 with DOI http://doi.org/10.1016/s0764-4469(00)01274-9
rs1799889_in_10.1007/s001090100192	rs1799889	SERPINE1	Italian (Central)	male/female	11485022	10.1007/s001090100192	http://doi.org/10.1007/s001090100192	rs1799889 genetic variant in  serpin family E member 1 (SERPINE1) with location 7q22.1 has non-significant association with longevity for male and femalein Italian (Central) population in a study conducted in 2001. The study had the following design: 205 donors (147 women, 58 men; aged 80-98 years, mean 86.1) were examined for the 1-bp guanine deletion/insertion (4G/5G) polymorphism in the promoter region. The study concluded the following. The 4G/5G polymorphism was not found to be associated with longevityThe study was published with pubmed id 11485022 with DOI http://doi.org/10.1007/s001090100192
G1691A_in_11568114	G1691A	F5	Danish, German, Dutch	male/female	11568114	11568114	http://doi.org/11568114	G1691A genetic variant in  coagulation factor V (F5) with location 1q24.2 has non-significant association with longevity for male and femalein Danish, German, Dutch population in a study conducted in 2001. The study had the following design: G1691A SNP was examined in 2689 healthy Caucasians aged 17-39 years (n = 979; 505 males and 474 females), 40-59 years (n = 900; 526 males and 374 females), and 60-85 years (n = 810; 530 males and 280 females). The study concluded the following. No statistically significant decrease in genotype or allele frequency was observed among carriers of F5The study was published with pubmed id 11568114 with DOI http://doi.org/11568114
C807T_in_11568114	C807T	ITGA2	English (Newcastle)	male/female	11568114	11568114	http://doi.org/11568114	C807T genetic variant in  integrin subunit alpha 2 (ITGA2) with location 5q11.2 has non-significant association with longevity for male and femalein English (Newcastle) population in a study conducted in 2001. The study had the following design: GPIa C807T SNP was examined in 2689 healthy Caucasians aged 17-39 years (n = 979; 505 males and 474 females), 40-59 years (n = 900; 526 males and 374 females), and 60-85 years (n = 810; 530 males and 280 females). The study concluded the following. No statistically significant decrease in genotype or allele frequency was observedThe study was published with pubmed id 11568114 with DOI http://doi.org/11568114
T1565C_in_11568114	T1565C	ITGB3	Spanish and Italian	male/female	11568114	11568114	http://doi.org/11568114	T1565C genetic variant in  integrin subunit beta 3 (ITGB3) with location 17q21.32 has significant association with longevity for male and femalein Spanish and Italian population in a study conducted in 2001. The study had the following design: T1565C SNP was examined in 2689 healthy Caucasians aged 17-39 years (n = 979; 505 males and 474 females), 40-59 years (n = 900; 526 males and 374 females), and 60-85 years (n = 810; 530 males and 280 females). The study concluded the following. The Pl(A2) allele frequency significantly decreased with ageThe study was published with pubmed id 11568114 with DOI http://doi.org/11568114
rs1801133_in_11568114	rs1801133	MTHFR	American (Utah)	male/female	11568114	11568114	http://doi.org/11568114	rs1801133 genetic variant in  methylenetetrahydrofolate reductase (MTHFR) with location 1p36.22 has non-significant association with longevity for male and femalein American (Utah) population in a study conducted in 2001. The study had the following design: C677T SNP was examined in 2689 healthy Caucasians aged 17-39 years (n = 979; 505 males and 474 females), 40-59 years (n = 900; 526 males and 374 females), and 60-85 years (n = 810; 530 males and 280 females). The study concluded the following. No statistically significant decrease in genotype or allele frequency was observed among carriers of 677TThe study was published with pubmed id 11568114 with DOI http://doi.org/11568114
rs1799963_in_11568114	rs1799963	F2	Chinese (Zhuang)	male/female	11568114	11568114	http://doi.org/11568114	rs1799963 genetic variant in  coagulation factor II, thrombin (F2) with location 11p11.2 has non-significant association with longevity for male and femalein Chinese (Zhuang) population in a study conducted in 2001. The study had the following design: F2 20210 G/A SNP was examined in 2689 healthy Caucasians aged 17-39 years (n = 979; 505 males and 474 females), 40-59 years (n = 900; 526 males and 374 females), and 60-85 years (n = 810; 530 males and 280 females). The study concluded the following. No statistically significant decrease in genotype or allele frequency was observed among carriers of F2The study was published with pubmed id 11568114 with DOI http://doi.org/11568114
rs1799752_in_11568114	rs1799752	ACE	Turkish	male/female	11568114	11568114	http://doi.org/11568114	rs1799752 genetic variant in  angiotensin I converting enzyme (ACE) with location 17q23.3 has non-significant association with longevity for male and femalein Turkish population in a study conducted in 2001. The study had the following design: I/D polymorphism was examined in 2689 healthy Caucasians: 17-39 years (n = 979; 505 males and 474 females), 40-59 years (n = 900; 526 males and 374 females), and 60-85 years (n = 810; 530 males and 280 females). The study concluded the following. No statistically significant decrease in genotype or allele frequency was observed among carriers of ACE DThe study was published with pubmed id 11568114 with DOI http://doi.org/11568114
rs1800795_in_10.1002/1521-4141(200108)31:8&#60;2357::aid-immu2357&#62;3.0.co;2-x	rs1800795	IL6	Chinese (Guangxi Bama)	male/female	11500818	10.1002/1521-4141(200108)31:8&#60;2357::aid-immu2357&#62;3.0.co;2-x	http://doi.org/10.1002/1521-4141(200108)31:8&#60;2357::aid-immu2357&#62;3.0.co;2-x	rs1800795 genetic variant in  interleukin 6 (IL6) with location 7p15.3 has significant association with longevity for male and femalein Chinese (Guangxi Bama) population in a study conducted in 2001. The study had the following design: 700 individuals (482 women and 218 men), ranging from 60 to 110 years of age including 323 centenarians were subdivided into three age-groups (60-80, 81-99 and over 99 years of age), and were assessed for -174 C/G locus variability. The study concluded the following. The proportion of homozygotes for the G allele decreases in centenarian males, but not in centenarian females. Among males, homozygotes for the G allele have higher IL-6 serum levels in comparison with carriers of the C allele.The study was published with pubmed id 11500818 with DOI http://doi.org/10.1002/1521-4141(200108)31:8&#60;2357::aid-immu2357&#62;3.0.co;2-x
rs1799752_in_10.1016/s0531-5565(01)00102-4	rs1799752	ACE	Danish, American	male/female	11602206	10.1016/s0531-5565(01)00102-4	http://doi.org/10.1016/s0531-5565(01)00102-4	rs1799752 genetic variant in  angiotensin I converting enzyme (ACE) with location 17q23.3 has non-significant association with longevity for male and femalein Danish, American population in a study conducted in 2001. The study had the following design: The I/D polymorphism was examined in 187 centenarians (47 males and 140 females) and 201 controls (20-64 years). The study concluded the following. No significant differences relative to longevity were foundThe study was published with pubmed id 11602206 with DOI http://doi.org/10.1016/s0531-5565(01)00102-4
M/T235_in_10.1016/s0531-5565(01)00102-4	M/T235	AGT	American (Amish) 	male/female	11602206	10.1016/s0531-5565(01)00102-4	http://doi.org/10.1016/s0531-5565(01)00102-4	M/T235 genetic variant in  angiotensinogen (AGT) with location 1q42.2 has significant association with longevity for male and femalein American (Amish)  population in a study conducted in 2001. The study had the following design: M/T235 SNP was examined in 187 centenarians (47 males and 140 females) and 201 controls (20-64 years). The study concluded the following. Significant influences on survival in males were observed, with reduced hazards of death for carriers of the M235 alleleThe study was published with pubmed id 11602206 with DOI http://doi.org/10.1016/s0531-5565(01)00102-4
rs1799963_in_10.1016/s0531-5565(01)00102-4	rs1799963	F2	American, English, Irish	male/female	11602206	10.1016/s0531-5565(01)00102-4	http://doi.org/10.1016/s0531-5565(01)00102-4	rs1799963 genetic variant in  coagulation factor II, thrombin (F2) with location 11p11.2 has non-significant association with longevity for male and femalein American, English, Irish population in a study conducted in 2001. The study had the following design: F2 20210 G/A SNP was examined in 187 centenarians (47 males and 140 females) and 201 controls (20-64 years). The study concluded the following. No association with longevity was foundThe study was published with pubmed id 11602206 with DOI http://doi.org/10.1016/s0531-5565(01)00102-4
F7_in_10.1016/s0531-5565(01)00102-4	F7	F7	Ashkenazi Jewish, Czechs (Bohemian)	male/female	11602206	10.1016/s0531-5565(01)00102-4	http://doi.org/10.1016/s0531-5565(01)00102-4	F7 genetic variant in  coagulation factor VII (F7) with location 13q34 has non-significant association with longevity for male and femalein Ashkenazi Jewish, Czechs (Bohemian) population in a study conducted in 2001. The study had the following design: Polymorphisms were examined in 187 centenarians (47 males and 140 females) and 201 controls (20-64 years). The study concluded the following. No association with longevity was foundThe study was published with pubmed id 11602206 with DOI http://doi.org/10.1016/s0531-5565(01)00102-4
